{"version":"v1","decision_id":"decision-1","deadline":"2030-01-01T00:00:10Z","observation":{"version":"v1","game_id":"game-1","worm_id":"worm-1","worm_instance_id":"worm-1-instance-a","decision_id":"decision-1","tick":7,"position":{"x":9,"y":9},"orientation":0,"neighbors":[{"direction":0,"position":{"x":10,"y":9},"occupied":false},{"direction":1,"position":{"x":10,"y":10},"occupied":false},{"direction":2,"position":{"x":9,"y":10},"occupied":true},{"direction":3,"position":{"x":8,"y":9},"occupied":false},{"direction":4,"position":{"x":8,"y":8},"occupied":false},{"direction":5,"position":{"x":9,"y":8},"occupied":false}],"trail_states":["empty","empty","other","empty","empty","empty"],"legal_actions":[{"kind":"move","direction":0},{"kind":"move","direction":1},{"kind":"resign"}],"scores":{"worm-1":2,"worm-2":1},"mode":"classic","deadline":"2030-01-01T00:00:10Z","brain_id":"brain-a","brain_version":"brain-a-v3","pattern_key":"0x00010203","provenance":{"seed":"42","observation":"fixture-v1"}}}
